{
  "$schema": "http://json-schema.org/draft-07/schema#",
  "title": "VideoData",
  "type": "array",
  "additionalItems": false,
  "items": {
    "type": "object",
    "required": ["videoId", "videoTags", "clips"],
    "additionalProperties": false,
    "properties": {
      "videoId": {
        "type": "string",
        "pattern": "^[A-Za-z0-9_-]{11}$"
      },
      "uploaderName": {
        "type": ["string", "null"],
        "minLength": 1
      },
      "videoTags": {
        "type": "array",
        "items": {
          "type": "string",
          "pattern": ".+"
        },
        "minItems": 1
      },
      "clips": {
        "type": "array",
        "additionalProperties": false,
        "minItems": 1,
        "items": {
          "type": "object",
          "required": ["songTitle", "liverIds", "startTime", "endTime"],
          "additionalProperties": false,
          "properties": {
            "songTitle": { "type": ["string"], "minLength": 1 },
            "liverIds": {
              "type": "array",
              "items": { "type": "string", "minLength": 1 },
              "minItems": 1
            },
            "externalArtistsName": {
              "type": ["array", "null"],
              "items": { "type": "string" },
              "minItems": 0
            },
            "clippedVideoId": {
              "type": ["string", "null"],
              "pattern": "^[A-Za-z0-9_-]{11}$"
            },
            "startTime": {
              "type": "string",
              "pattern": "^PT([0-9]+H)?([0-9]+M)?([0-9]+S)?$"
            },
            "endTime": {
              "type": "string",
              "pattern": "^PT([0-9]+H)?([0-9]+M)?([0-9]+S)?$"
            },
            "clipTags": {
              "type": ["array", "null"],
              "items": {
                "type": "string",
                "pattern": "^[a-z0-9]+(-[a-z0-9]+)*$"
              },
              "minItems": 0
            }
          }
        }
      }
    }
  }
}
