[
  {
    "videoId": "qfMRqe6hhxs",
    "uploaderName": null,
    "videoTags": [
      "2d",
      "karaoke"
    ],
    "clips": [
      {
        "songTitle": "初恋サイダー",
        "liverIds": [
          "ayane-shirasa"
        ],
        "externalArtistsName": null,
        "clippedVideoId": null,
        "startTime": "PT1M58S",
        "endTime": "PT5M25S",
        "clipTags": null
      },
      {
        "songTitle": "とくベチュ、して",
        "liverIds": [
          "ayane-shirasa"
        ],
        "externalArtistsName": null,
        "clippedVideoId": null,
        "startTime": "PT8M26S",
        "endTime": "PT12M24S",
        "clipTags": null
      },
      {
        "songTitle": "アララの呪文",
        "liverIds": [
          "ayane-shirasa"
        ],
        "externalArtistsName": null,
        "clippedVideoId": null,
        "startTime": "PT15M51S",
        "endTime": "PT19M1S",
        "clipTags": null
      },
      {
        "songTitle": "MOON PRIDE",
        "liverIds": [
          "ayane-shirasa"
        ],
        "externalArtistsName": null,
        "clippedVideoId": null,
        "startTime": "PT21M9S",
        "endTime": "PT24M46S",
        "clipTags": null
      },
      {
        "songTitle": "GO! GO! MANIAC",
        "liverIds": [
          "ayane-shirasa"
        ],
        "externalArtistsName": null,
        "clippedVideoId": null,
        "startTime": "PT27M27S",
        "endTime": "PT31M31S",
        "clipTags": null
      },
      {
        "songTitle": "MUGO・ん・・・色っぽい",
        "liverIds": [
          "ayane-shirasa"
        ],
        "externalArtistsName": null,
        "clippedVideoId": null,
        "startTime": "PT34M42S",
        "endTime": "PT38M30S",
        "clipTags": null
      },
      {
        "songTitle": "青空のラプソディ",
        "liverIds": [
          "ayane-shirasa"
        ],
        "externalArtistsName": null,
        "clippedVideoId": null,
        "startTime": "PT41M8S",
        "endTime": "PT45M42S",
        "clipTags": null
      },
      {
        "songTitle": "I WITH",
        "liverIds": [
          "ayane-shirasa"
        ],
        "externalArtistsName": null,
        "clippedVideoId": null,
        "startTime": "PT50M8S",
        "endTime": "PT54M52S",
        "clipTags": null
      },
      {
        "songTitle": "おさかな天国",
        "liverIds": [
          "ayane-shirasa"
        ],
        "externalArtistsName": null,
        "clippedVideoId": null,
        "startTime": "PT57M20S",
        "endTime": "PT1H1M33S",
        "clipTags": null
      }
    ]
  }
]