[
  {
    "videoId": "5GsswoDivZI",
    "uploaderName": null,
    "videoTags": [
      "2d",
      "karaoke"
    ],
    "clips": [
      {
        "songTitle": "恋の魔法",
        "liverIds": [
          "ruri-shioriha"
        ],
        "externalArtistsName": null,
        "clippedVideoId": null,
        "startTime": "PT2M",
        "endTime": "PT5M19S",
        "clipTags": null
      },
      {
        "songTitle": "君色に染まる",
        "liverIds": [
          "ruri-shioriha"
        ],
        "externalArtistsName": null,
        "clippedVideoId": null,
        "startTime": "PT8M59S",
        "endTime": "PT12M10S",
        "clipTags": null
      },
      {
        "songTitle": "風になる",
        "liverIds": [
          "ruri-shioriha"
        ],
        "externalArtistsName": null,
        "clippedVideoId": null,
        "startTime": "PT15M5S",
        "endTime": "PT19M40S",
        "clipTags": null
      },
      {
        "songTitle": "Campus mode!!",
        "liverIds": [
          "ruri-shioriha"
        ],
        "externalArtistsName": null,
        "clippedVideoId": null,
        "startTime": "PT25M25S",
        "endTime": "PT29M36S",
        "clipTags": null
      },
      {
        "songTitle": "新宝島",
        "liverIds": [
          "ruri-shioriha"
        ],
        "externalArtistsName": null,
        "clippedVideoId": null,
        "startTime": "PT31M35S",
        "endTime": "PT36M33S",
        "clipTags": null
      },
      {
        "songTitle": "きらり",
        "liverIds": [
          "ruri-shioriha"
        ],
        "externalArtistsName": null,
        "clippedVideoId": null,
        "startTime": "PT39M55S",
        "endTime": "PT43M43S",
        "clipTags": null
      },
      {
        "songTitle": "カタオモイ",
        "liverIds": [
          "ruri-shioriha"
        ],
        "externalArtistsName": null,
        "clippedVideoId": null,
        "startTime": "PT48M30S",
        "endTime": "PT51M58S",
        "clipTags": null
      },
      {
        "songTitle": "火星人",
        "liverIds": [
          "ruri-shioriha"
        ],
        "externalArtistsName": null,
        "clippedVideoId": null,
        "startTime": "PT53M3S",
        "endTime": "PT56M56S",
        "clipTags": null
      },
      {
        "songTitle": "おねがいダーリン",
        "liverIds": [
          "ruri-shioriha"
        ],
        "externalArtistsName": null,
        "clippedVideoId": null,
        "startTime": "PT58M40S",
        "endTime": "PT1H1M53S",
        "clipTags": null
      }
    ]
  }
]