[
  {
    "videoId": "yHCcyyQR_YU",
    "uploaderName": null,
    "videoTags": ["2d", "karaoke"],
    "clips": [
      {
        "songTitle": "あなたといたい",
        "liverIds": ["meruto-kuramochi"],
        "externalArtistsName": null,
        "clippedVideoId": null,
        "startTime": "PT2M8S",
        "endTime": "PT5M39S"
      },
      {
        "songTitle": "月に吠える",
        "liverIds": ["meruto-kuramochi"],
        "externalArtistsName": null,
        "clippedVideoId": null,
        "startTime": "PT10M30S",
        "endTime": "PT14M54S"
      },
      {
        "songTitle": "melt bitter",
        "liverIds": ["meruto-kuramochi"],
        "externalArtistsName": null,
        "clippedVideoId": null,
        "startTime": "PT17M12S",
        "endTime": "PT22M18S"
      },
      {
        "songTitle": "Hello, Again 〜昔からある場所〜",
        "liverIds": ["meruto-kuramochi"],
        "externalArtistsName": null,
        "clippedVideoId": null,
        "startTime": "PT24M25S",
        "endTime": "PT29M36S"
      },
      {
        "songTitle": "それがあなたの幸せとしても",
        "liverIds": ["meruto-kuramochi"],
        "externalArtistsName": null,
        "clippedVideoId": null,
        "startTime": "PT31M15S",
        "endTime": "PT35M42S"
      },
      {
        "songTitle": "それを愛と呼ぶなら",
        "liverIds": ["meruto-kuramochi"],
        "externalArtistsName": null,
        "clippedVideoId": null,
        "startTime": "PT39M52S",
        "endTime": "PT44M42S"
      },
      {
        "songTitle": "DRESSING ROOM",
        "liverIds": ["meruto-kuramochi"],
        "externalArtistsName": null,
        "clippedVideoId": null,
        "startTime": "PT46M24S",
        "endTime": "PT49M14S"
      },
      {
        "songTitle": "Same Blue",
        "liverIds": ["meruto-kuramochi"],
        "externalArtistsName": null,
        "clippedVideoId": null,
        "startTime": "PT51M28S",
        "endTime": "PT55M21S"
      },
      {
        "songTitle": "片っぽ",
        "liverIds": ["meruto-kuramochi"],
        "externalArtistsName": null,
        "clippedVideoId": null,
        "startTime": "PT57M54S",
        "endTime": "PT1H1M34S"
      },
      {
        "songTitle": "泥中に咲く",
        "liverIds": ["meruto-kuramochi"],
        "externalArtistsName": null,
        "clippedVideoId": null,
        "startTime": "PT1H4M41S",
        "endTime": "PT1H9M21S"
      },
      {
        "songTitle": "lulu.",
        "liverIds": ["meruto-kuramochi"],
        "externalArtistsName": null,
        "clippedVideoId": null,
        "startTime": "PT1H12M34S",
        "endTime": "PT1H17M5S"
      }
    ]
  }
]
